{
  "version": "0.2.0",
  "directory": "examples/client",
  "purpose": "Machine-readable navigator for public client recipes grouped by task, runtime, and consumption path.",
  "groups": [
    {
      "id": "shell-live-validator",
      "title": "cURL live validator routes",
      "description": "Minimal shell entrypoints for the published validator HTTP routes with bearer auth.",
      "audiences": [
        "integrators",
        "contributors"
      ],
      "primary_docs": [
        "docs/client-recipes.md",
        "docs/route-reference.md"
      ],
      "recommended_start": "curl-validate-single.sh",
      "files": [
        "curl-validate-single.sh",
        "curl-validate-batch.sh",
        "curl-validate-fix.sh",
        "curl-get-gates.sh",
        "curl-get-stats.sh"
      ]
    },
    {
      "id": "node-live-validator",
      "title": "Node live validator routes",
      "description": "Small fetch-based runtime clients for the published validator routes.",
      "audiences": [
        "integrators",
        "contributors"
      ],
      "primary_docs": [
        "docs/client-recipes.md",
        "docs/integration-guide.md"
      ],
      "recommended_start": "node-validate-single.mjs",
      "files": [
        "node-validate-single.mjs",
        "node-validate-batch.mjs",
        "node-validate-fix.mjs",
        "node-get-gates.mjs",
        "node-get-stats.mjs"
      ]
    },
    {
      "id": "source-level-types",
      "title": "Source-level TypeScript and Zod",
      "description": "Repo-relative typed navigators, readers, request builders, route summaries, and response parsers.",
      "audiences": [
        "integrators",
        "tool-builders"
      ],
      "primary_docs": [
        "docs/type-projections.md",
        "docs/client-recipes.md"
      ],
      "recommended_start": "ts-client-recipe-index.ts",
      "files": [
        "ts-client-recipe-index.ts",
        "zod-parse-client-recipe-index.ts",
        "ts-parse-archive-bundle.ts",
        "ts-capsule-summary.ts",
        "zod-parse-archive-bundle.ts",
        "zod-parse-capsule.ts",
        "ts-openapi-route-summary.ts",
        "openapi-generate-validator-types.mjs",
        "ts-envelope-family-reference.ts",
        "ts-route-behavior-reference.ts",
        "ts-build-validate-request.ts",
        "ts-build-validate-batch-request.ts",
        "ts-build-validate-fix-request.ts",
        "ts-live-validator-client.ts",
        "ts-parse-validate-requests.ts",
        "zod-parse-validate-request.ts",
        "zod-parse-validate-batch-request.ts",
        "zod-parse-validate-fix-request.ts",
        "ts-parse-validate-responses.ts",
        "ts-parse-error-responses.ts",
        "ts-parse-support-responses.ts",
        "zod-parse-error-responses.ts",
        "zod-parse-validate-response.ts",
        "zod-parse-validate-fail-response.ts",
        "zod-parse-validate-batch-response.ts",
        "zod-parse-validate-fix-response.ts",
        "zod-parse-support-responses.ts"
      ]
    },
    {
      "id": "raw-schema-ajv",
      "title": "Raw schema and bundle Ajv recipes",
      "description": "Repo-local and installed-package CommonJS, ESM, plus TypeScript Ajv consumers for positive validation and structural rejection across the published JSON contracts.",
      "audiences": [
        "integrators",
        "tool-builders"
      ],
      "primary_docs": [
        "docs/schema-validation-recipes.md",
        "docs/archive-validation-recipes.md"
      ],
      "recommended_start": "ajv-validate-capsule.mjs",
      "files": [
        "ajv-validate-capsule.mjs",
        "ajv-validate-validator-envelope.mjs",
        "ajv-validate-archive-bundle.mjs",
        "ajv-validate-client-recipe-index.mjs",
        "ajv-validate-schema-bundles.mjs",
        "ajv-reject-invalid-archive-bundles.mjs",
        "ajv-reject-invalid-client-recipe-index.mjs",
        "ajv-reject-invalid-capsules.mjs",
        "ajv-reject-invalid-validator-envelopes.mjs",
        "cjs-package-ajv-validate-archive-bundle.cjs",
        "cjs-package-ajv-validate-schema-bundles.cjs",
        "cjs-package-ajv-validate-contracts.cjs",
        "cjs-package-ajv-reject-invalid-archive-bundles.cjs",
        "cjs-package-ajv-reject-invalid-capsules.cjs",
        "cjs-package-ajv-reject-invalid-validator-envelopes.cjs",
        "cjs-package-ajv-validate-client-recipe-index.cjs",
        "cjs-package-ajv-reject-invalid-client-recipe-index.cjs",
        "esm-package-ajv-validate-contracts.mjs",
        "esm-package-ajv-validate-archive-bundle.mjs",
        "esm-package-ajv-validate-client-recipe-index.mjs",
        "esm-package-ajv-validate-schema-bundles.mjs",
        "esm-package-ajv-reject-invalid-archive-bundles.mjs",
        "esm-package-ajv-reject-invalid-client-recipe-index.mjs",
        "esm-package-ajv-reject-invalid-capsules.mjs",
        "esm-package-ajv-reject-invalid-validator-envelopes.mjs",
        "ts-package-ajv-validate-archive-bundle.ts",
        "ts-package-ajv-validate-schema-bundles.ts",
        "ts-package-ajv-validate-contracts.ts",
        "ts-package-ajv-reject-invalid-archive-bundles.ts",
        "ts-package-ajv-reject-invalid-capsules.ts",
        "ts-package-ajv-reject-invalid-validator-envelopes.ts",
        "ts-package-ajv-validate-client-recipe-index.ts",
        "ts-package-ajv-reject-invalid-client-recipe-index.ts"
      ]
    },
    {
      "id": "integrity-recipes",
      "title": "Integrity seal recipes",
      "description": "Public G16 recomputation and teaching-example repair flows.",
      "audiences": [
        "integrators",
        "reviewers"
      ],
      "primary_docs": [
        "docs/integrity-recipes.md"
      ],
      "recommended_start": "recompute-integrity-seal.mjs",
      "files": [
        "recompute-integrity-seal.mjs",
        "esm-package-recompute-integrity-seal.mjs"
      ]
    },
    {
      "id": "python-consumers",
      "title": "Python consumers",
      "description": "Cross-language readers, archive parsers, and live validator flows from repo and packed artifacts.",
      "audiences": [
        "integrators",
        "tool-builders"
      ],
      "primary_docs": [
        "docs/python-consumption.md",
        "docs/client-recipes.md"
      ],
      "recommended_start": "python-live-validator-client.py",
      "files": [
        "python-client-recipe-index.py",
        "python-parse-archive-bundle.py",
        "python-contract-reference.py",
        "python-openapi-reference.py",
        "python-live-validator-client.py",
        "python-recompute-integrity-seal.py",
        "python-validate-single.py",
        "python-validate-batch.py",
        "python-validate-fix.py",
        "python-get-gates.py",
        "python-get-stats.py",
        "python-parse-validate-responses.py",
        "python-parse-error-responses.py",
        "python-parse-support-responses.py"
      ]
    },
    {
      "id": "package-runtime",
      "title": "CommonJS and ESM package consumers",
      "description": "Installed-package runtime readers, recipe navigation, live clients, Ajv flows, and OpenAPI consumers.",
      "audiences": [
        "integrators",
        "tool-builders"
      ],
      "primary_docs": [
        "docs/npm-consumption.md",
        "docs/openapi-codegen-recipes.md"
      ],
      "recommended_start": "cjs-package-live-validator-client.cjs",
      "files": [
        "cjs-package-capsule-summary.cjs",
        "cjs-package-client-recipe-index.cjs",
        "cjs-package-contract-reference.cjs",
        "cjs-package-openapi-codegen.cjs",
        "cjs-package-openapi-reference.cjs",
        "cjs-package-error-responses.cjs",
        "cjs-package-live-validator-client.cjs",
        "cjs-package-validate-request.cjs",
        "cjs-package-support-responses.cjs",
        "cjs-package-validate-response.cjs",
        "esm-package-capsule-summary.mjs",
        "esm-package-client-recipe-index.mjs",
        "esm-package-contract-reference.mjs",
        "esm-package-openapi-codegen.mjs",
        "esm-package-openapi-reference.mjs",
        "esm-package-error-responses.mjs",
        "esm-package-live-validator-client.mjs",
        "esm-package-validate-request.mjs",
        "esm-package-support-responses.mjs",
        "esm-package-validate-response.mjs"
      ]
    },
    {
      "id": "package-typescript",
      "title": "TypeScript package consumers",
      "description": "Installed-package typed request, response, archive, route, navigator, and OpenAPI codegen entrypoints.",
      "audiences": [
        "integrators",
        "tool-builders"
      ],
      "primary_docs": [
        "docs/npm-consumption.md",
        "docs/type-projections.md"
      ],
      "recommended_start": "ts-package-live-validator-client.ts",
      "files": [
        "ts-package-parse-archive-bundle.ts",
        "ts-package-client-recipe-index.ts",
        "ts-package-error-responses.ts",
        "ts-package-contract-reference.ts",
        "ts-package-openapi-codegen.ts",
        "ts-package-openapi-reference.ts",
        "ts-package-live-validator-client.ts",
        "ts-package-support-responses.ts",
        "ts-package-validate-responses.ts",
        "ts-package-parse-validate-requests.ts",
        "ts-package-validate-request.ts",
        "ts-package-validate-batch-request.ts",
        "ts-package-validate-fix-request.ts"
      ]
    }
  ],
  "task_entrypoints": [
    {
      "id": "live-validate-single",
      "intent": "Send one capsule to POST /api/validate",
      "primary_group": "shell-live-validator",
      "recommended": "curl-validate-single.sh",
      "alternatives": [
        "node-validate-single.mjs",
        "python-validate-single.py",
        "ts-live-validator-client.ts"
      ],
      "docs": [
        "docs/client-recipes.md",
        "docs/route-reference.md",
        "docs/integration-guide.md"
      ],
      "runtimes": [
        "shell",
        "node",
        "python",
        "typescript"
      ]
    },
    {